{
  "schema_version": "1.0.0",
  "slice_id": "world-slice-leonardo-1502-1504-v1",
  "status": "CURATION_IN_PROGRESS",
  "unit": "minutes",
  "entries": [
    {
      "activity_id": "cost-scope-and-source-triage",
      "activity": "Scope definition and institutional source triage",
      "actor_kind": "agent_assisted",
      "duration_minutes": null,
      "measurement_state": "pending",
      "notes": "The artifact establishes the cost-log shape without inventing elapsed time. The responsible curator must record actual duration before the package can become READY."
    },
    {
      "activity_id": "cost-claim-and-locator-curation",
      "activity": "Atomic Claim, locator and uncertainty curation",
      "actor_kind": "human_curator",
      "duration_minutes": null,
      "measurement_state": "pending",
      "notes": "Not started in the scope-freeze artifact."
    },
    {
      "activity_id": "cost-independent-review",
      "activity": "Independent semantic and geometry review",
      "actor_kind": "independent_reviewer",
      "duration_minutes": null,
      "measurement_state": "pending",
      "notes": "No review has been performed."
    }
  ],
  "ready_rule": "Every entry must be measured and review cost must be recorded before READY."
}
